MIN,Item Name,Department
104220201,M LARGE UNSMOKED GAMMON JOINT,Bacon
104220235,M LARGE SMK GAMMON JOINT 5.2KG,Bacon
104226240,M GAMMON JOINT 2.2KG,Bacon
105035699,M Medium Smoked Gammon Joint,Bacon
106789652,Morrisons Smoked Gammon Joint 1.4Kg,Bacon
102793312,Prepared In Store British Topside Steak 230G,Beef
102793321,Prepared In Store British Topside Joint 1.35Kg,Beef
102793339,Prepared In Store British Diced Topside 290G,Beef
102793363,Prepared In Store British Silverside Joint 0.9Kg,Beef
102793380,Prepared In Store British Salmon Cut Joint 0.7Kg,Beef
102793419,Prepared In Store British Brisket Joint 1.35Kg,Beef
102793427,Prepared In Store British Thick Rib Joint 950G,Beef
102793478,Prepared In Store British Rib Eye Steak 290G,Beef
102793494,Prepared In Store British Fillet Steak 150G,Beef
102793507,Prepared In Store British Rump Steak 350G,Beef
102793540,Prepared In Store British Sirloin Steak 300G,Beef
102793654,Market Street British Best Braising Steak 0.6Kg,Beef
102793662,Market Street British Beef Braising Steak 0.6Kg,Beef
102793689,British Beef Mince 550G,Beef
102793769,Market Street British Lean Casserole Steak 0.65Kg,Beef
102793865,Prepared In Store British Beef Sandwich Steak 250G,Beef
102794016,Prepared In Store Scotch Topside Joint 1Kg,Beef
102794024,Prepared In Store Scotch Diced Topside 540G,Beef
102794041,Prepared In Store Scotch Salmon Cut Joint 880G,Beef
102794083,Prepared In Store Scotch Thick Rib Joint 690G,Beef
102794139,Prepared In Store Scotch Rib Eye Steak 200G,Beef
102794155,Prepared In Store Scotch Fillet Steak 200G,Beef
102794163,Market Street Scottish Rump Popeseye Steak 0.625Kg,Beef
102794201,Prepared In Store Scotch Sirloin Steaks 200G,Beef
102794286,Market Street Scottish Best Braising Steak 0.6Kg,Beef
102794294,Market Street Scottish Shoulder Steak Braising 600G,Beef
102794315,Market Street Scottish Butchers Mince Steak 0.625Kg,Beef
102794403,Market Street Scottish Lean Casserole Steak 0.65Kg,Beef
104597622,Handmade British Beef Steak Burgers X2,Beef
104597665,Handmade British Beef Steak Burgers X4,Beef
104597673,Handmade Scotch Beef Steak Burgers X4,Beef
108333149,Morrisons The Best Multi-Seed Loaf 800G,Bought In Breads
108333190,Morrisons The Best Sunflower & Pumpkin Bread 800G,Bought In Breads
105492742,Morrisons Belgian Bun 2Pk,Cakeshop
105493913,Morrisons Cinnamon Bun 2Pk,Cakeshop
105499071,Market Street Cream Chocolate Eclairs 4 Pk,Cakeshop
105529322,Morrisons Profiterole Stack 12Pk,Cakeshop
105615167,M Blueberry Muffins 4Pk,Cakeshop
105615183,M Triple Choc Muffins 4 Pack,Cakeshop
105615212,M Lemon Muffins 4Pk,Cakeshop
105615239,M Chocolate Chunk Muffin 4 Pack,Cakeshop
105628494,Morrisons Fresh Cream Meringues 2Pk,Cakeshop
105628620,Morrisons Fresh Cream Apple Turnovers 2Pk,Cakeshop
105628646,Morrisons Fresh Cream Raspberry Turnover 2Pk,Cakeshop
105628718,Morrisons Fresh Cream Fruited Scones 2Pk,Cakeshop
105629850,Morrisons Fresh Cream Strawberry Sundae,Cakeshop
105629913,Morrisons Fresh Cream Vanilla Muffins 2Pk,Cakeshop
105630025,Morrisons Fresh Cream Profiterole Sundae,Cakeshop
105630068,Morrisons Fresh Cream Black Cherry Sundae,Cakeshop
105630092,Morrisons The Best Fresh Cream Scone 2Pk,Cakeshop
105630236,Morrisons Fresh Cream Sponge,Cakeshop
105630252,Morrisons Fresh Cream Large Sponge,Cakeshop
105630279,Morrisons Fresh Cream Chocolate Sponge,Cakeshop
105630308,Market Street Large Fresh Cream Chocolate Sponge,Cakeshop
105630324,Market Street Butterfly Sponge,Cakeshop
105630447,Morrisons Profiterole Bowl Dessert,Cakeshop
105630631,Morrisons Medium Strawberry Flan,Cakeshop
105658095,Morrisons Cinnamon Swirl 2Pk,Cakeshop
105658175,Morrisons Pecan Plait 2Pk,Cakeshop
105658191,Morrisons Apple Turnover 2Pk,Cakeshop
105658255,Morrisons Eccles Cake 2Pk,Cakeshop
105713197,M Vanilla Creme Crowns 2 Pack,Cakeshop
105713251,M White Chocolate Chunk Cookies 5 Pack,Cakeshop
105713277,M Double Chocolate Chunk Cookies 5 Pack,Cakeshop
105713293,M Milk Chocolate Chunk Cookies 5 Pack,Cakeshop
105713314,M Oat And Raisin Cookies 5 Pack,Cakeshop
105713373,The Best Belgian Milk Cookies 4Pk,Cakeshop
105713411,The Best Triple Chocolate Cookies 4Pk,Cakeshop
105713648,M Fresh Cream Chocolate And Cherry Muffins 2Pk,Cakeshop
105867487,M Fresh Cream Black Forest Gateau,Cakeshop
106251203,Morrisons Fresh Cream Lemon Muffins 2Pk,Cakeshop
106251318,Morrisons Fresh Cream Lemon Sponge,Cakeshop
107733028,Morrisons Portuguese Tarts 2 Pack,Cakeshop
108102261,Morrisons Raspberry Trifle,Cakeshop
108405659,Morrisons Fresh Cream Palmier,Cakeshop
108808212,Morrisons The Best Belgian Milk Chocolate Shortbread Cookies 4Pk,Cakeshop
108808239,Morrisons The Best Granola Squares 4Pk,Cakeshop
108886691,Morrisons Market St Fresh Cream White Iced Fingers 2Pk,Cakeshop
109349257,Morrisons Lemon Meringue Tart,Cakeshop
109368343,Market Street Mixed Fruit Tart,Cakeshop
109368482,Morrisons Strawberry Tart,Cakeshop
109368589,Morrisons Banoffee Tart,Cakeshop
109726201,Market Street Strawberry & Cream Meringues 2Pk,Cakeshop
111393601,Market Street Fresh Cream Ball Doughnuts 2 Pack,Cakeshop
112362760,Market Street Strawberry Victoria Sponge Cake Slice,Cakeshop
112399870,Market Street Chocolate Cake Slice,Cakeshop
113084466,Market Street Lemon Meringue Pie Slice,Cakeshop
113178374,Market Street Caramelised Biscuit Brownie Bowl,Cakeshop
113250727,Market Street Toffee Yum Yums 4 Pk,Cakeshop
113250751,Market Street Yum Yums 4 Pk,Cakeshop
104786079,Wyke Mature Cheddar 125g,Cheese (Deli)
104786191,Davidstow Cheddar 125g,Cheese (Deli)
104786247,Tickler Extra Mature Cheddar 125g,Cheese (Deli)
104786765,Clawson Reserve Blue Stilton 125g,Cheese (Deli)
104786896,Shepherd Purse Yorkshire Blue 125g,Cheese (Deli)
104786933,Castello Danish Blue 125g,Cheese (Deli)
104788912,French Brie 125g,Cheese (Deli)
104788939,Isigny Creamy Brie 125G,Cheese (Deli)
104789350,Edam Ball 125G,Cheese (Deli)
104789499,Red Fox Crunchy Red Leicester 125G,Cheese (Deli)
104789552,Traditional Wensleydale 125G,Cheese (Deli)
104789579,Bavarian Smoked Cheese 125G,Cheese (Deli)
104789595,Applewood Smoked Cheddar 125G,Cheese (Deli)
104789843,White Stilton Exp 125G,Cheese (Deli)
104806471,Belton'S Cheshire Cheese 125G,Cheese (Deli)
104806498,Coloured Cheshire Cheese 125G,Cheese (Deli)
104899401,Wensleydale And Cranberry Cheese 125G,Cheese (Deli)
105082348,Cambozola Cheese 125G,Cheese (Deli)
105137581,Wensleydale Cheddar With Pickled Onion 125G,Cheese (Deli)
105174584,Blacksticks Blue 125G,Cheese (Deli)
105546413,M Double Gloucester Express 125G,Cheese (Deli)
105546464,M Red Leicester Express 125G,Cheese (Deli)
105547230,Morrisons Double Gloucester  With Onion And Chives 125G,Cheese (Deli)
105549577,Cricket St Thomas Somerset Brie 125G,Cheese (Deli)
109846894,Morrisons The Best Cropwell Bishop Blue Stilton ,Cheese (Deli)
110278441,Wensleydale & Apricots  Cheese 125g,Cheese (Deli)
109086872,Yorkshire Cured Ham 150G,Cooked Meats And Pate
109088798,Pressed Ox Tongue 150G,Cooked Meats And Pate
111543577,Market Street Deli Thickly Sliced Wiltshire Ham 125G,Cooked Meats And Pate
102407961,Boneless Salmon Fillet 300G,Counter Seafood
102408154,Morrisons Whole Rainbow Trout 840G,Counter Seafood
102408277,Morrisons Fresh British Whole Herring 150G,Counter Seafood
102408576,Market Street Lemon Sole Fillet 120G,Counter Seafood
102409616,Morrisons Sardines 220G,Counter Seafood
102409739,Morrisons Octopus 200G,Counter Seafood
102409755,Market Street Ray Wings 390G,Counter Seafood
102410043,"Market Street Monkfish Tails 330G
",Counter Seafood
102410633,Market Street Whole Seabass 700G,Counter Seafood
102413201,Smoked Haddock Fillet With No Colour 245G,Counter Seafood
109584943,Morrisons Cod Fillet 350G,Counter Seafood
109589488,"Market Street Smoked Cod Loin Colour 400G
",Counter Seafood
105813649,Morrisons Spray Carnation Flowers Bouquet,Cut Flowers
106428793,Morrisons Chrysanthemum,Cut Flowers
105488559,4 Large Vegetable Samosas ,Deli Kitchen Retail
105517786,4 Large Chicken Satay Skewers ,Deli Kitchen Retail
105520985,12 Mini Sweet Chilli Chicken Satays ,Deli Kitchen Retail
106584032,12 Vegetable Spring Rolls ,Deli Kitchen Retail
106584198,12 Mini Vegetable Samosas ,Deli Kitchen Retail
110184533,4 Duck Spring Rolls ,Deli Kitchen Retail
110184744,4 Large Vegetable Pakoras ,Deli Kitchen Retail
110184816,4 Chicken Katsu Spring Rolls ,Deli Kitchen Retail
110184883,4 Red Onion Bhajis ,Deli Kitchen Retail
102398726,WHOLE GATEAU / CHOCOLATE FUDGE,FTO Cakeshop
105630412,MORRISONS FRESH CREAM LARGE STRAWBERRY GATEAU,FTO Cakeshop
108255128,Morrisons Cookies 21 Party Pack,FTO Cakeshop
109905313,MORRISONS FRUIT TART PLATTER,FTO Cakeshop
109905356,MORRISONS THE BEST SCONE PLATTER,FTO Cakeshop
112018643,MORRISONS PASTRIES PLATTER 8 PACK,FTO Cakeshop
112390091,MORRISONS CAKESHOP CHOCOLATE PLATTER,FTO Cakeshop
112594376,MORRISONS WHOLE VICTORIA SPONGE CAKE,FTO Cakeshop
113380986,WHOLE LEMON MERINGUE CAKE,FTO Cakeshop
114233953,MORRISONS CHRISTMAS ICED DOUGHNUTS 12PK,FTO Cakeshop
114399865,MORRISONS THE BEST MILK CHOCOLATE GIANT COOKIE HAPPY BIRTHDAY,FTO Cakeshop
114399937,MORRISONS THE BEST MILK CHOCOLATE GIANT COOKIE GOOD LUCK,FTO Cakeshop
114399953,MORRISONS THE BEST MILK CHOCOLATE GIANT COOKIE THANK YOU,FTO Cakeshop
114399970,MORRISONS THE BEST MILK CHOCOLATE GIANT COOKIE IT'S A BOY!,FTO Cakeshop
114399996,MORRISONS THE BEST MILK CHOCOLATE GIANT COOKIE IT'S A GIRL!,FTO Cakeshop
114400011,MORRISONS THE BEST MILK CHOCOLATE GIANT COOKIE I LOVE YOU,FTO Cakeshop
114400053,MORRISONS THE BEST TRIPLE CHOCOLATE GIANT COOKIE HAPPY BIRTHDAY,FTO Cakeshop
114406421,MORRISONS THE BEST TRIPLE CHOCOLATE GIANT COOKIE IT'S A GIRL!,FTO Cakeshop
114406447,MORRISONS GIANT BROWNIE GOOD LUCK,FTO Cakeshop
114406480,MORRISONS THE BEST TRIPLE CHOCOLATE GIANT COOKIE THANK YOU,FTO Cakeshop
114406501,MORRISONS THE BEST TRIPLE CHOCOLATE GIANT COOKIE IT'S A BOY!,FTO Cakeshop
114451601,MORRISONS GIANT BROWNIE THANK YOU,FTO Cakeshop
114452064,MORRISONS THE BEST TRIPLE CHOCOLATE GIANT COOKIE I LOVE YOU,FTO Cakeshop
114452136,MORRISONS GIANT BROWNIE HAPPY ANNIVERSARY,FTO Cakeshop
114452953,MORRISONS GIANT BROWNIE I LOVE YOU,FTO Cakeshop
114452970,MORRISONS GIANT BROWNIE HAPPY BIRTHDAY,FTO Cakeshop
114472903,MORRISONS THE BEST MILK CHOCOLATE GIANT COOKIE  MERRY CHRISTMAS,FTO Cakeshop
114472946,MORRISONS THE BEST MILK CHOCOLATE GIANT COOKIE HAPPY NEW YEAR,FTO Cakeshop
114472971,MORRISONS THE BEST TRIPLE CHOCOLATE GIANT COOKIE MERRY CHRISTMAS,FTO Cakeshop
114473412,MORRISONS THE BEST TRIPLE CHOCOLATE GIANT COOKIE HAPPY NEW YEAR,FTO Cakeshop
114479814,MORRISONS THE BEST TRIPLE CHOCOLATE GIANT COOKIE WELL DONE,FTO Cakeshop
114480057,MORRISONS THE BEST MILK CHOCOLATE GIANT COOKIE WELL DONE,FTO Cakeshop
104490180,Deli style coleslaw 900g,FTO Deli
105957503,Cooked Meats Platter,FTO Deli
111988525,MORRISONS SPICY GRAZING BOX,FTO Deli
111988710,MORRISONS PLOUGHMANS GRAZING BOX,FTO Deli
111988736,MORRISONS SMALL CHEESE BOX,FTO Deli
111988752,MORRISONS LARGE CHEESE BOX,FTO Deli
111988779,MORRISONS CONTINENTAL GRAZING BOX,FTO Deli
111988795,MORRISONS SAVOURY GRAZING BOX,FTO Deli
111988816,MORRISONS LARGE CONTINENTAL GRAZING BOX,FTO Deli
111988832,MORRISONS LARGE SAVOURY GRAZING BOX,FTO Deli
102780968,SPICY CHICKEN PASTA 750G (L),FTO Food_To_Go
104490243,Deli Style Potato Salad 900g,FTO Food_To_Go
104490331,Italian Pasta 750g,FTO Food_To_Go
104490673,Tuna & S'Corn Pasta 900g,FTO Food_To_Go
109272835,MORRISONS 16 PIECE WRAP PLATTER 1.4KG (CO),FTO Food_To_Go
109894731,MORRISONS 8 PIECE GLUTEN FREE SANDWICH PLATTER,FTO Food_To_Go
110811226,MORRISONS MEAT SANDWICH PLATTER 1.4KG (CO),FTO Food_To_Go
110816596,MORRISONS VEGGIE SANDWICH PLATTER 893G (CO),FTO Food_To_Go
111528123,MORRISONS CLASSIC SANDWICH PLATTER 821G (CO),FTO Food_To_Go
112657736,MORRISONS PASTA BACON & CHEESE SALAD 750G,FTO Food_To_Go
112658122,SWEET CHILLI NOODLES 750G,FTO Food_To_Go
112675395,MORRISONS TOMATO AND BASIL COUSCOUS 750G,FTO Food_To_Go
114027033,DEL MONTE FRUIT PLATTER 1.17KG,FTO Food_To_Go
114131199,MORRISONS SANDWICH PARTY PLATTER,FTO Food_To_Go
114182501,MORRISONS GLUTEN FREE SANDWICH PLATTER,FTO Food_To_Go
114200879,MORRISONS SUSHI PLATTER,FTO Food_To_Go
114230402,MORRISONS CHRISTMAS SANDWICH PLATTER,FTO Food_To_Go
104721494,White Split Tin 800G,In Store Bakery
104721523,White Split Tin 800G Sliced,In Store Bakery
104721582,'M' White Split Tin 400G,In Store Bakery
104721603,'M' White Split Tin 400G Sliced,In Store Bakery
104721654,Bloomer/White Bread 800G,In Store Bakery
104721718,Bloomer/White Bread 400G,In Store Bakery
104721742,Bloomer/White Bread 400G Sliced,In Store Bakery
104726439,M Wholemeal Bread 800G ,In Store Bakery
104726471,M Wholemeal Bread 400G ,In Store Bakery
104726674,M Tiger Bread 400G ,In Store Bakery
104726720,M Tiger Bread 800G ,In Store Bakery
104727811,M Wholemeal Bread Sliced 400G ,In Store Bakery
104728872,M Granary Loaf/ Malted Brown 800G,In Store Bakery
104728995,M Granary Loaf/ Malted Brown Sliced 800G,In Store Bakery
104729138,M Granary Loaf/ Matled Brown Sliced 400G,In Store Bakery
104735722,Morrisons Small White Baguette,In Store Bakery
104735773,M Small Tiger Stick ,In Store Bakery
104736151,M Large White Baguette 400G,In Store Bakery
104737891,Sandwich Baguette White 4Pk,In Store Bakery
104737939,M Large White Baps 6Pk,In Store Bakery
104738026,Farmhouse/White Bread 800G,In Store Bakery
104738069,Morrisons White Farmhouse 400G,In Store Bakery
104738131,M Large Tiger Baps 6 Pack,In Store Bakery
104738296,Morrisons Coburg Cob 400G,In Store Bakery
104738317,Wheat Spelt & Rye Bread 400G,In Store Bakery
104738325,Chocolate Twist 2 Pack,In Store Bakery
104739424,Morrisons The Best Fruit Scones 4 Pack,In Store Bakery
104739512,Hot Cross Buns 4Pk,In Store Bakery
104739619,Scottish Crumpets 6 Pack,In Store Bakery
104742025,M Finger Rolls White 6 Pack ,In Store Bakery
104742480,M Sub Rolls White Bread 4 Pack ,In Store Bakery
104742501,M Large Baps Cheese/Onion 4Pk ,In Store Bakery
104742869,M Large Granary Baps 6 Pack ,In Store Bakery
104744178,M Large Baps/ Wholemeal 6 Pack,In Store Bakery
104744573,M Crusty Rolls 6 Pack,In Store Bakery
104744611,M Tiger Rolls 4 Pack,In Store Bakery
104744830,Potato Scones 6 Pack,In Store Bakery
104745461,Doughnuts/Sugar Ring 6Pk,In Store Bakery
104745576,Doughnuts/Raspberry 5Pk,In Store Bakery
104745613,Doughnuts/Custard 5Pk,In Store Bakery
104745630,Doughnuts/Strawberry 5Pk,In Store Bakery
104745832,Iced Ring Doughnuts 4Pk,In Store Bakery
104745891,Scotch Morning Rolls 6Pk,In Store Bakery
104745912,Well Fired Scotch Rolls 6Pk,In Store Bakery
104746157,M Jam Doughnuts 5 Pack (Non Bakery Stores),In Store Bakery
104750682,Large White Baps 2Pk,In Store Bakery
104788592,Market Street Large White Baps 18Pk,In Store Bakery
104814981,Wheat Spelt & Rye Tin Loaf 800G,In Store Bakery
105055981,Large Wholemeal Baps 2Pk,In Store Bakery
105735290,Tiger Bloomer Sliced 800G,In Store Bakery
105735361,Tiger Loaf Sliced 400G,In Store Bakery
105775591,Pain Au Raisin 2Pk,In Store Bakery
106308118,Morrisons Black Pepper And Sea Salt Tiger Short Stick,In Store Bakery
106308441,Morrisons Black Pepper And Sea Salt Bloomer 400G,In Store Bakery
106337541,Morrisons Sea Salt & Pepper Bloomer 800G,In Store Bakery
106361445,Morrisons Farmhouse Sliced Loaf 400G,In Store Bakery
106361488,Morrisons Farmhouse Sliced Loaf 800G,In Store Bakery
107168209,Morrisons Butter Croissants 4Pk,In Store Bakery
107391591,Morrisons Hand Stretched Ciabatta,In Store Bakery
107391726,Morrisons Large Salt & Pepper Baps 6Pk,In Store Bakery
107391742,Morrisons Fruited Teacakes 4 Pack,In Store Bakery
108154212,Morrisons Stonebaked Ciabatta 2Pk,In Store Bakery
108221729,Morrisons Cinnamon Swirl,In Store Bakery
108363102,Morrisons Large Salt & Pepper Baps 6Pk,In Store Bakery
109706912,Morrisons Pain Au Chocolat 2Pk,In Store Bakery
110114834,Morrisons Panini 2Pk,In Store Bakery
110270191,Morrisons Almond Croissants 2Pk,In Store Bakery
110455129,Morrisons Pain Au Chocolat,In Store Bakery
110986069,Morrisons Medium Granary Baps 4Pk,In Store Bakery
110986106,Morrisons Medium Wholemeal Baps 4Pk,In Store Bakery
110998781,Morrisons Ciabattas 2 Pack,In Store Bakery
111004653,Morrisons Salted Popcorn 120G,In Store Bakery
111013630,Morrisons 6 Medium Cheese Baps,In Store Bakery
111040030,Morrisons 24 Medium White Baps,In Store Bakery
111167276,Market Street Snack Ciabattas 4Pk,In Store Bakery
111250491,Morrisons Toffee Popcorn 250G,In Store Bakery
113153100,Market Street Vienna Rolls 4Pk,In Store Bakery
113156925,Market Street Deli Rolls With Sourdough 2Pk,In Store Bakery
102796484,Prepared In Store British Leg Of Lamb 2.25Kg,Lamb
102796505,Prepared In Store British Lamb Shank 370G,Lamb
102796548,Prepared In Store British Lamb Shoulder 900G,Lamb
102796581,Prepared In Store British Lamb Chops 350G,Lamb
102796636,Prepared In Store British Rack Of Lamb 625G,Lamb
102796679,Market Street British Spring Lamb Ribs 500G,Lamb
102796804,Morrisons British Lamb Breast 325G,Lamb
102796812,Morrisons British Lamb Stuffed Breast 340G,Lamb
102796901,Prepared In Store Scotch Leg Of Lamb 1Kg,Lamb
102796927,Prepared In Store Scotch Lamb Shank 400G,Lamb
102796960,Market Street Scotch Spring Lamb Shoulder 0.9Kg,Lamb
102797006,Market Street Scotch Spring Lamb Chops 0.35Kg,Lamb
102797090,Market Street Scottish Lamb Ribs 0.5Kg,Lamb
102797129,Market Street Scotch Spring Lamb Leg Steak 0.4Kg,Lamb
102797305,Market Street Welsh Spring Lamb Shank 0.48Kg,Lamb
102797348,Market Street Welsh Spring Lamb Shoulder 1.1Kg,Lamb
102797381,Prepared In Store Welsh Lamb Chops 340G,Lamb
102797444,Prepared In Store Welsh Rack Of Lamb,Lamb
102797487,Market Street Welsh Lamb Ribs 0.5Kg,Lamb
102797516,Morrisons Welsh Lamb Leg Steak 280G,Lamb
110604243,Market Street Prepared In Store Flavoured Lamb Leg Steak 0.4Kg,Lamb
110615698,Market Street Flavoured Lamb Ribs 0.5Kg,Lamb
108561184,Morrisons Pumpkin,Other Veg
104775901,Large Melton Mowbray Pork Pie ,Pies And Snacks
109463501,10 Inch Might Meaty Deep Pan Pizza,Pizza Fresh Prep
109463607,Morrisons 10 Inch Deep Pan Double Pepperoni Pizza,Pizza Fresh Prep
109463640,10 Inch Extra Cheesy Deep Pan Pizza,Pizza Fresh Prep
109463762,10 Inch Extra Cheesy Pizza Thin Stonebaked Pizza,Pizza Fresh Prep
109463922,Morrisons 10 Inch Thin Stonebaked Veg Supreme Pizza,Pizza Fresh Prep
109463965,10 Inch Bbq Chicken & Bacon Feast Thin Stonebaked Pizza,Pizza Fresh Prep
109464079,10 Inch Mighty Meaty Thin Stonebaked Pizza,Pizza Fresh Prep
109464335,10 Inch Garlic & Cheese Bread Thin Stonebaked,Pizza Fresh Prep
109464394,10 Inch Pepperoni Thin Stonebaked Pizza,Pizza Fresh Prep
109464669,14 Inch Mighty Meaty Thin & Crispy Pizza,Pizza Fresh Prep
109464731,Morrisons 14 Inch Thin Stonebaked Double Pepperoni Pizza,Pizza Fresh Prep
109464781,14 Inch Extra Cheesy Feast Thin & Crispy Pizza,Pizza Fresh Prep
111086759,"Market Street Veggie Supreme Deep Pan 10"" Pizza",Pizza Fresh Prep
112757956,"Market Street Ham & Pineapple Stonebaked 10"" Pizza",Pizza Fresh Prep
112758051,"Market Street Sizzler Stonebaked 10"" Pizza",Pizza Fresh Prep
112764398,"Market Street Sizzler Thin Stonebaked 14"" Pizza",Pizza Fresh Prep
113685691,"Morrisons 10"" Chicken & Nduja Pizza",Pizza Fresh Prep
113685801,"Market Street Half & Half 14"" Pepperoni X Meatball Marinara Pizza",Pizza Fresh Prep
113687179,"Market Street 10"" Meatball Marinara Pizza",Pizza Fresh Prep
102798391,Market Street British Pork Ribs 0.5Kg,Pork
102798480,British Boneless Leg Of Pork 3.5Kg,Pork
102798498,Market Street British Pork Leg Steak 0.5Kg,Pork
102798535,British Boneless Shoulder Of Pork 1.75Kg,Pork
102798560,Market Street British Pork Loin/ Boneless Joint 0.8Kg,Pork
102798586,British Pork Loin Steaks 0.4Kg,Pork
102798615,Market Street British Pork Fillet 400G,Pork
102798623,Market Street British Pork Belly Slices 625G,Pork
102798631,Market Street British Boneless Pork Belly Joint 725G,Pork
109529266,Gressingham Duck Fat 250G,Speciality Poultry
112487247,Royal Mail 8 X 1St Class Stamp Book,Stamps
112487360,Royal Mail 8 X 2Nd Class Stamp Book,Stamps
112487423,Royal Mail 4 X 1St Class Large Letter Stamp Book,Stamps
112487474,Royal Mail 4 X 2Nd Class Large Letter Stamp Book,Stamps
101525851,Rizla Green Multipack,Tobacco Products (Splits)
101526677,Rizla Silver Papers,Tobacco Products (Splits)
101528605,Swan Extra Slim Filter Tip 120,Tobacco Products (Splits)
101531601,St Bruno Ready Rubbed 50Gm,Tobacco Products (Splits)
101534811,Swan Slimline Filter Tips 102,Tobacco Products (Splits)
101541551,Swan Menthol Ex Slim Tips 120,Tobacco Products (Splits)
101545561,Cricket Lighters 3 Pack (Cr),Tobacco Products (Splits)
101545616,Rizla Liquorice Papers,Tobacco Products (Splits)
101546942,Poppell Elec. Lighter (Cr),Tobacco Products (Splits)
101550351,St Bruno Flake Tobacco 50Gm,Tobacco Products (Splits)
101554328,Erinmore Mixture           50G,Tobacco Products (Splits)
101554459,Poppell Flint Lighter (Cr),Tobacco Products (Splits)
101558927,Rizla Ks Slim Blue 32'S,Tobacco Products (Splits)
101560752,Swan Gas Refill 200Ml (R),Tobacco Products (Splits)
101560883,Rizla K/S Slim Silver Papers,Tobacco Products (Splits)
101563419,Rizla Green Papers,Tobacco Products (Splits)
101568421,Rizla Blue Papers,Tobacco Products (Splits)
101577749,Swan Slimline Filter Tip 165,Tobacco Products (Splits)
102334141,Jps Myo Tubes,Tobacco Products (Splits)
104747871,Zig Zag Green 8Pk Papers,Tobacco Products (Splits)
106012624,Swan Ultra Slim Filter 126S,Tobacco Products (Splits)
108543357,Royal Dutch Miniature 10Pk,Tobacco Products (Splits)
108543429,Royal Dutch Miniature 20Pk,Tobacco Products (Splits)
108543592,Royal Dutch Miniature Blue Cigars 20Pk,Tobacco Products (Splits)
108543621,Royal Dutch Elite Slim Pan Cigars 5Pk,Tobacco Products (Splits)
108543656,Royal Dutch Double Filter 10S,Tobacco Products (Splits)
108568546,Signature Original 50S,Tobacco Products (Splits)
108568618,Signature Original 10S,Tobacco Products (Splits)
108568693,Signature Blue 10S,Tobacco Products (Splits)
108568731,Signature Blue 50S,Tobacco Products (Splits)
108568950,Henri Wintermans Slims 5S,Tobacco Products (Splits)
108568984,Henri Wintermans Half Corona 5S,Tobacco Products (Splits)
108569055,Moments Miniatures Blue 10S,Tobacco Products (Splits)
108569101,Clan Original 50G,Tobacco Products (Splits)
108579595,Embassy Filter 20Pk,Tobacco Products (Splits)
108579721,Embassy Signature Gold 20Pk,Tobacco Products (Splits)
108618558,Villiger Export Pressed Cigars 5Pk,Tobacco Products (Splits)
108665784,Carlton Original 20 Pack,Tobacco Products (Splits)
108666091,Carlton Original Superkings 20 Pack,Tobacco Products (Splits)
108666226,Carlton Superkings Bright Blue 20Pk,Tobacco Products (Splits)
108666322,Castella Classic Fine Cigars 10Pk,Tobacco Products (Splits)
108666365,Castella Classic Fine Cigars 5 X 5 Multipack,Tobacco Products (Splits)
108666390,Castella Classic Fine Cigars 5Pk,Tobacco Products (Splits)
108666496,Gold Leaf Virginia Blend 50G Includes Cigarette Papers,Tobacco Products (Splits)
108666517,John Player Special Legendary Black 20Pk,Tobacco Products (Splits)
108666576,John Player Special Real Blue 20Pk,Tobacco Products (Splits)
108666736,John Player Special Superkings Real Blue 20Pk,Tobacco Products (Splits)
108666904,King Edward Coronets Premium Blend 5Pk,Tobacco Products (Splits)
108666939,L&B Blue Real Blue 20Pk,Tobacco Products (Splits)
108666998,L&B Blue Bright Air Filter 20 Pack,Tobacco Products (Splits)
108667042,L&B Blue Superkings Real Blue 20Pk,Tobacco Products (Splits)
108667173,L&B Blue Superkings Bright Blue 20Pk,Tobacco Products (Splits)
108667350,Lambert & Butler Bright Gold 20Pk,Tobacco Products (Splits)
108667405,Lambert & Butler Original Silver 20Pk,Tobacco Products (Splits)
108667544,Panama Thin Panatellas 6Pk,Tobacco Products (Splits)
108667595,Players Real Red 20Pk,Tobacco Products (Splits)
108667982,Players Bright Blue 20Pk,Tobacco Products (Splits)
108668037,Players Real Red 50G Can,Tobacco Products (Splits)
108668088,Players Superkings Real Red 20Pk,Tobacco Products (Splits)
108668133,Players Superkings Bright Blue 20Pk,Tobacco Products (Splits)
108668205,Regal Blue 20Pk,Tobacco Products (Splits)
108668272,Richmond Original 20 Pack,Tobacco Products (Splits)
108668301,Richmond Real Blue 5 X 20 Multipack,Tobacco Products (Splits)
108668758,Richmond Superkings Real Blue 20Pk,Tobacco Products (Splits)
108668774,Richmond Superkings Bright Blue 20Pk,Tobacco Products (Splits)
108668862,Windsor Blue Real Blue 20Pk,Tobacco Products (Splits)
108668977,Windsor Blue Superkings Real Blue 20Pk,Tobacco Products (Splits)
108669195,Drum The Original Blue 30G,Tobacco Products (Splits)
108669224,Drum The Original Blue 50G,Tobacco Products (Splits)
108669267,Drum Gold 30G,Tobacco Products (Splits)
108669355,Gold Leaf Virginia Blend 30G Includes Cigarette Papers,Tobacco Products (Splits)
108669443,Golden Virginia The Original 30G Includes Cigarette Papers,Tobacco Products (Splits)
108669486,Gv Bright Yellow 30G Includes Cigarette Papers,Tobacco Products (Splits)
108669515,Gv Bright Yellow 50G Includes Cigarette Papers,Tobacco Products (Splits)
108669558,Golden Virginia The Original 50G Includes Cigarette Papers,Tobacco Products (Splits)
108669700,Jps Bright Silver Stream 20 Pack,Tobacco Products (Splits)
108669734,Regal Filter 20 Pack,Tobacco Products (Splits)
108669831,Superkings Original Black 20Pk,Tobacco Products (Splits)
108669902,Superkings Bright Blue 20Pk,Tobacco Products (Splits)
108670461,Blu Pro Clearomiser,Tobacco Products (Splits)
108677339,Blu Pro E-Liquid Blueberry 1.6%,Tobacco Products (Splits)
108677515,Blu Pro E-Liquid Menthol 1.6%,Tobacco Products (Splits)
108705601,Condor Ready Rubbed Tobacco 50G,Tobacco Products (Splits)
108705782,Hamlet Miniature 10Pk,Tobacco Products (Splits)
108705846,Hamlet Fine 10Pk,Tobacco Products (Splits)
108783617,Moments 5 Panatella Cigars,Tobacco Products (Splits)
108783668,Moments 20 Blue Cigars,Tobacco Products (Splits)
108807720,Hamlet Fine 5Pk,Tobacco Products (Splits)
